budget,genres,keywords,original_language,overview,popularity,release_date,revenue,runtime,tagline,title,vote_average,companies,countries,languages
35000000,Comedy,"['music record', 'rock and roll', 'pop', 'hip-hop', 'fab four', 'blues', 'pop star', 'rapper', 'record producer', 'rock', 'music', 'music instrument', 'wedding', 'extramarital affair', 'aftercreditsstinger']",en,Singer Dewey Cox overcomes adversity to become a musical legend.,10.73522,2007-12-21,18317151,96.0,Life made him tough. Love made him strong. Music made him hard.,Walk Hard: The Dewey Cox Story,6.6,Columbia Pictures Corporation,United States of America,English
35000000,Drama,"['royal family', 'biography', 'royalty', 'period drama', 'queen victoria', 'prince albert', '19th century', 'british monarchy']",en,"From Academy Award® winners Graham King and Martin Scorsese, along with the makers of Gosford Park and The Departed, comes the story of Queen Victoria’s early rise to power. From an object of a royal power-struggle to her romantic courtship and legendary marriage to Prince Albert, Emily Blunt (The Devil Wears Prada) gives a stunning performance as the young Victoria. Packed with drama, romance, breath-taking cinematography, lavish costumes and featuring an outstanding British cast including Jim Broadbent, Harriet Walter, Mark Strong, Paul Bettany, Miranda Richardson, and Rupert Friend, The Young Victoria has captivated British audiences, and is the film that Company magazine called “an epic British film, which will sweep you up in her remarkable story.”",16.343317000000006,2009-03-04,27409889,105.0,Love rules all.,The Young Victoria,7.0,GK Films,United Kingdom,English
40000000,Action,"['airplane', 'based on comic book', 'corpse', 'stich']",en,"The only U.S. Marshal assigned to Antarctica, Carrie Stetko will soon leave the harsh environment behind for good – in three days, the sun will set and the Amundsen-Scott Research Station will shut down for the long winter. When a body is discovered out on the open ice, Carrie's investigation into the continent's first homicide plunges her deep into a mystery that may cost her her own life.",14.818718,2009-09-09,12206028,101.0,See Your Last Breath,Whiteout,5.3,StudioCanal,Canada,English
32000000,Drama,"['philosophy', 'father son relationship', 'red hair', 'brother sister relationship', 'sun', 'telegram', 'tree', 'meteor', 'afterlife', 'death of a child', 'independent film', 'spirituality', 'outer space', 'dinosaur', 'voice over', 'very little dialogue', 'tarkovskyesque']",en,"The impressionistic story of a Texas family in the 1950s. The film follows the life journey of the eldest son, Jack, through the innocence of childhood to his disillusioned adult years as he tries to reconcile a complicated relationship with his father. Jack finds himself a lost soul in the modern world, seeking answers to the origins and meaning of life while questioning the existence of faith.",43.862456,2011-05-18,54674226,139.0,Nothing stands still.,The Tree of Life,6.5,Fox Searchlight Pictures,United States of America,English
20500000,Action,"['broken neck', 'fbi agent', 'wall safe', 'trashed house', 'aerial shot', 'military dress uniform', 'vanity', 'flare', 'woman director']",en,"Waging his one-man war on the world of organized crime, ruthless vigilante-hero Frank Castle sets his sights on overeager mob boss Billy Russoti. After Russoti is left horribly disfigured by Castle, he sets out for vengeance under his new alias: Jigsaw. With the ""Punisher Task Force"" hot on his trail and the FBI unable to take Jigsaw in, Frank must stand up to the formidable army that Jigsaw has recruited before more of his evil deeds go unpunished.",17.112498000000002,2008-12-05,10089373,102.0,Vengeance has a name,Punisher: War Zone,5.6,Lionsgate,Canada,Pусский
35000000,Adventure,"['1970s', 'skyscraper', 'based on true story', 'tightrope', 'planning', 'world trade center']",en,The story of French high-wire artist Philippe Petit's attempt to cross the Twin Towers of the World Trade Center in 1974.,37.335721,2015-09-30,61181942,123.0,Dream High.,The Walk,6.9,TriStar Pictures,United States of America,Français
34000000,Action,"['based on novel', 'maze', 'post-apocalyptic', 'dystopia', 'escape', 'memory loss', 'erased memory', 'trapped', 'dystopic future', 'runner', 'based on young adult novel']",en,"Set in a post-apocalyptic world, young Thomas is deposited in a community of boys after his memory is erased, soon learning they're all trapped in a maze that will require him to join forces with fellow ""runners"" for a shot at escape.",131.815575,2014-09-10,348319861,113.0,Run - Remember - Survive,The Maze Runner,7.0,Ingenious Media,United States of America,English
35000000,Drama,"['brain tumor', 'operation', 'queen', ""love of one's life"", 'surgeon', 'tree', 'dying and death', 'transience', 'immortality', 'maya civilization', 'monkey', 'conquest']",en,"Spanning over one thousand years, and three parallel stories, The Fountain is a story of love, death, spirituality, and the fragility of our existence in this world.",24.606012,2006-09-06,15304890,96.0,Death is the road to awe,The Fountain,6.8,Regency Enterprises,United States of America,English
50000000,Action,"['corruption', 'scandal', 'shadowing', 'police']",en,"Maverick cop Orin Boyd always brings down the domestic terrorists he tracks, but he ruffles feathers with his unorthodox techniques -- and soon finds himself reassigned to the toughest district in Detroit. When he discovers a group of detectives secretly operating a drug ring, Boyd joins forces with an unlikely ally -- gangster Latrell Walker -- to bring down the rotten cops.",12.601306,2001-03-13,79958599,101.0,This Is Gonna Hurt,Exit Wounds,5.3,Village Roadshow Pictures,Canada,Italiano
34000000,Family,"['magic', '3d']",en,"Thunder, an abandoned young cat seeking shelter from a storm, stumbles into the strangest house imaginable, owned by an old magician and inhabited by a dazzling array of automatons and gizmos. Not everyone welcomes the new addition to the troupe as Jack Rabbit and Maggie Mouse plot to evict Thunder. The situation gets worse when the magician lands in hospital and his scheming nephew sees his chance to cash in by selling the mansion. Our young hero is determined to earn his place and so he enlists the help of some wacky magician's assistants to protect his magical new home.",12.867326,2013-12-24,0,85.0,One lost little cat. One magical adventure.,Thunder and the House of Magic,6.3,StudioCanal,Belgium,Deutsch
30000000,Horror,"['alien invasion', 'american abroad', 'moscow', 'unlikely heroes', 'failed business']",en,"In Moscow, five young people lead the charge against an alien race which has attacked Earth via our power supply.",23.328823,2011-12-22,64626786,89.0,Survive The Holidays,The Darkest Hour,4.8,Summit Entertainment,United States of America,English
33000000,Action,"['chain', 'submachine gun', 'undercover', 'smuggling', 'twin brother', 'marvel comic', 'one man army', 'massacre', 'extreme violence', 'family reunion', 'pier']",en,"When undercover FBI agent Frank Castle's wife and son are slaughtered, he becomes 'the Punisher' -- a ruthless vigilante willing to go to any length to avenge his family.",35.099611,2004-04-15,54700105,124.0,"There is no justice, there is only revenge.",The Punisher,6.1,Lions Gate Films,Germany,English
30000000,Action,['broken trachea'],en,"After a former elite agent rescues a 12-year-old Chinese girl who's been abducted, they find themselves in the middle of a standoff between Triads, the Russian Mafia and high-level corrupt New York City politicians and police.",31.92695,2012-04-16,40346186,94.0,She has the code. He is the key.,Safe,6.3,Lawrence Bender Productions,United States of America,English
32350000,Adventure,"['rebel', 'brother sister relationship', 'emperor', 'space battle', 'matter of life and death', 'spaceship', 'death star', 'jabba the hutt', 'ewoks', 'jedi', 'space opera']",en,"As Rebel leaders map their strategy for an all-out attack on the Emperor's newer, bigger Death Star. Han Solo remains frozen in the cavernous desert fortress of Jabba the Hutt, the most loathsome outlaw in the universe, who is also keeping Princess Leia as a slave girl. Now a master of the Force, Luke Skywalker rescues his friends, but he cannot become a true Jedi Knight until he wages his own crucial battle against Darth Vader, who has sworn to win Luke over to the dark side of the Force.",46.509071,1983-05-23,572700000,135.0,The Empire Falls...,Return of the Jedi,7.9,Lucasfilm,United States of America,English
35000000,Comedy,"['hippie', 'commune', 'nudism', 'nude protest', 'aftercreditsstinger', 'duringcreditsstinger']",en,"Rattled by sudden unemployment, a Manhattan couple surveys alternative living options, ultimately deciding to experiment with living on a rural commune where free love rules.",20.908494,2012-02-23,24159934,98.0,Leave your baggage behind,Wanderlust,5.3,Relativity Media,United States of America,English
32000000,Comedy,"['nun', 'sport', 'orphanage', 'ordensbruder', 'ringer', 'money']",en,"Nacho Libre is loosely based on the story of Fray Tormenta (""Friar Storm""), aka Rev. Sergio Gutierrez Benitez, a real-life Mexican Catholic priest who had a 23-year career as a masked luchador. He competed in order to support the orphanage he directed. The producers are Jack Black, David Klawans, Julia Pistor, and Mike White.",14.642055,2006-06-16,80197993,92.0,He's not lean. He's not mean. He's nacho average hero.,Nacho Libre,5.6,Paramount Pictures,United States of America,Español
32500000,Comedy,"['competition', 'jealousy', 'fight', 'materialism', 'bridesmaid', 'female friendship', 'fear of commitment', 'wealth', 'mother daughter relationship', 'wedding party', 'sexual humor', 'best friend', 'maid of honor', 'drunk', 'wedding dress', 'group of friends', 'casual sex', 'vanity', 'girl fight', 'missing woman', 'out of control']",en,"Annie’s life is a mess. But when she finds out her lifetime best friend is engaged, she simply must serve as Lillian’s maid of honor. Though lovelorn and broke, Annie bluffs her way through the expensive and bizarre rituals. With one chance to get it perfect, she’ll show Lillian and her bridesmaids just how far you’ll go for someone you love.",17.107065,2011-04-28,288383523,125.0,Save the date,Bridesmaids,6.5,Universal Pictures,United States of America,English
32000000,Action,"['rape', 'monster', 'panic', 'friendship', 'celebrity', 'satire', 'party', 'possession', 'dark comedy', 'end of the world', 'apocalypse', 'drug', 'demon', 'self-referential', 'actor']",en,"While attending a party at James Franco's house, Seth Rogen, Jay Baruchel and many other celebrities are faced with the apocalypse.",38.21708,2013-06-12,126041322,107.0,Nothing ruins a party like the end of the world.,This Is the End,6.3,Columbia Pictures,United States of America,English
32000000,Action,['heist'],en,"A seasoned team of bank robbers, including Gordon Jennings (Idris Elba), John Rahway (Paul Walker), A.J. (Hayden Christensen), and brothers Jake (Michael Ealy) and Jesse Attica (Chris Brown) successfully complete their latest heist and lead a life of luxury while planning their next job. When Ghost (Tip T.I. Harris), a former member of their team, is released from prison he convinces the group to strike an armored car carrying $20 million. As the ""Takers"" carefully plot out their strategy and draw nearer to exacting the grand heist, a reckless police officer (Matt Dillon) inches closer to apprehending the criminals.",18.47242,2010-08-26,69055695,107.0,Who's Taking Who?,Takers,6.0,Rainforest Films,United States of America,English
32000000,Crime,"['undercover', 'fbi', 'sequel', 'comedy', 'disguise', 'fbi agent', 'impersonation', 'duringcreditsstinger']",en,"FBI agent Malcolm Turner and his 17-year-old son, Trent, go undercover at an all-girls performing arts school after Trent witnesses a murder. Posing as Big Momma and Charmaine, they must find the murderer before he finds them.",15.901137,2011-02-16,83615414,107.0,Momma's got back-up.,"Big Mommas: Like Father, Like Son",5.3,Twentieth Century Fox Film Corporation,United States of America,English
32000000,Thriller,"['bomb', 'identity', 'fantasy', 'bomber', 'suspicion', 'time travel', 'investigation', 'surrealism', 'soldier', 'helicopter pilot']",en,"Decorated soldier Captain Colter Stevens wakes up in the body of an unknown man, discovering he's involved in a mission to find the bomber of a Chicago commuter train. He learns he's part of a top-secret experimental program that enables him to experience the final 8 minutes of another person's life. Colter re-lives the train incident over and over again, gathering more clues each time. But can he discover who is responsible for the attack before the next one happens?",59.19888,2011-03-30,147332697,93.0,Make Every Second Count,Source Code,7.1,The Mark Gordon Company,Canada,English
30000000,Thriller,"['suicide', 'based on novel', 'hotel room', 'obsession', 'sadomasochism', 'psychological thriller', 'killer', 'family', 'numbers']",en,"Walter Sparrow is an animal control officer that becomes obsessed with a mysterious book that seems to be based on his own life. As soon as he opens the book, he notices strange parallels between what he reads and what he's experienced. But now he's worried that a fictional murder might materialize.",23.197408,2007-02-23,77566815,101.0,First it takes hold of your mind...then it takes hold of your life.,The Number 23,6.3,New Line Cinema,Germany,English
32000000,Action,"['dystopia', 'evil corporation', 'repo man', 'aftercreditsstinger']",en,"In the future, medical technology has advanced to the point where people can buy artificial organs to extend their lives. But if they default on payments, an organization known as the Union sends agents to repossess the organs. Remy is one of the best agents in the business, but when he becomes the recipient of an artificial heart, he finds himself in the same dire straits as his many victims.",25.799697,2010-03-18,18409891,111.0,"For a price, any organ in your body can be replaced. But it can also be repossessed.",Repo Men,6.2,Universal Pictures,Canada,English
32000000,War,"['berlin', 'corruption', 'nazi background', ""love of one's life"", 'chauffeur', 'black market', 'missile', 'postwar period', 'war correspondent', 'allied', 'truth', 'murder', 'humanity']",en,An American journalist played by George Clooney arrives in Berlin just after the end of World War Two. He becomes involved in a murder mystery surrounding a dead GI who washes up at a lakeside mansion during the Potsdam negotiations between the Allied powers. Soon his investigation connects with his search for his married pre-war German lover played by Cate Blanchett.,5.347936,2006-12-08,5914908,108.0,"If war is Hell, then what comes after?",The Good German,5.9,Warner Bros.,United States of America,English
31500000,Drama,"['guerrilla', 'river', 'vietnam', 'vietcong', 'cambodia', 'army', 'insanity', 'tribe', 'green beret', 'jungle', 'apocalypse', 'death', 'napalm']",en,"At the height of the Vietnam war, Captain Benjamin Willard is sent on a dangerous mission that, officially, ""does not exist, nor will it ever exist."" His goal is to locate - and eliminate - a mysterious Green Beret Colonel named Walter Kurtz, who has been leading his personal army on illegal guerrilla missions into enemy territory.",49.973462,1979-08-15,89460381,153.0,This is the end...,Apocalypse Now,8.0,United Artists,United States of America,
32000000,Comedy,"['male nudity', 'sex', 'san francisco', 'waitress', 'newspaper', 'bar', 'nudity', 'airplane', 'male female relationship', 'writer', 'new york city', 'masturbation', 'phone sex', 'text messaging', 'intern', 'long distance relationship', 'woman director', 'record company', 'skype']",en,"Erin and Garrett are very much in love. When Erin moves to San Francisco to finish her journalism degree and Garrett stays behind in New York to work in the music industry, they gamely keep the romance alive with webcams and frequent-flyer miles. But just when it seems the lovers will soon be reunited, they each score a big break that could separate them for good.",13.611544,2010-09-01,42045846,102.0,A comedy about meeting each other halfway.,Going the Distance,6.0,New Line Cinema,United States of America,English
34000000,Action,"['venice', 'mass murder', 'space marine', 'space suit', 'marcus square', 'space battle', 'secret base', 'utopia', 'space travel', 'boat chase', 'astronaut', 'lasers', 'british secret service', 'weightlessness']",en,During the transportation of a Space Shuttle a Boeing 747 crashes in the Atlantic Ocean yet when they go to look for the destroyed shuttle it is not there. James Bond investigates the missing mission space shuttle and soon learns that the shuttles owner Hugo Drax wants to kill all of mankind.,29.887404,1979-06-26,210308099,126.0,Outer space now belongs to 007.,Moonraker,5.9,United Artists,France,English
30000000,Drama,"['ku klux klan', 'american football', 'trainer', 'sports team', 'race politics', 'coaction', 'apartheid', 'sport', 'high school', 'racial segregation', 'racist', 'based on true story', 'american football player', 'xenophobia', 'head coach']",en,"After leading his football team to 15 winning seasons, coach Bill Yoast is demoted and replaced by Herman Boone – tough, opinionated and as different from the beloved Yoast as he could be. The two men learn to overcome their differences and turn a group of hostile young men into true champions.",25.996219,2000-09-29,136706683,113.0,History is written by the winners.,Remember the Titans,7.4,Walt Disney Pictures,United States of America,English
30000000,Action,"['submarine', 'cold war', 'russian', 'defection', 'jack ryan']",en,"A new Soviet nuclear missile sub (a Boomer) heading out on her maiden voyage that is being tracked by a Los Angeles class American submarine suddenly goes silent and ""disappears"". This focuses the attention of both U.S. Intelligence and the U.S. Navy on the Russian Sub Commander .  When it is determined that the silent Soviet Boomer may be headed for American coastal waters panic ensues. A CIA analyst, Jack Ryan,  convinces the brass that the Boomer's commander may intend something other than a nuclear first strike in mind. A perilous and tense cat-and-mouse game ensues.",46.212155,1990-03-02,199200000,134.0,Invisible. Silent. Stolen.,The Hunt for Red October,7.2,Paramount Pictures,United States of America,English
33000000,Crime,"['self-fulfilling prophecy', 'detective', 's.w.a.t.', 'drug dealer', 'evisceration', 'lust and impulsiveness', 'rage and hate', 'pride and vanity', 'immoderateness', 'insomnia', 'investigation', 'pension', 'police', 'serial killer']",en,"Two homicide detectives are on a desperate hunt for a serial killer whose crimes are based on the ""seven deadly sins"" in this dark and haunting film that takes viewers from the tortured remains of one victim to the next. The seasoned Det. Sommerset researches each sin in an effort to get inside the killer's mind, while his novice partner, Mills, scoffs at his efforts to unravel the case.",79.579532,1995-09-22,327311859,127.0,Seven deadly sins. Seven ways to die.,Se7en,8.1,New Line Cinema,United States of America,English
30000000,Science Fiction,"['slum', 'street gang', 'mutation', 'south africa', 'johannesburg', 'dystopia', 'genetics', 'government', 'satire', 'alien', 'prawn', 'mockumentary', 'alternate history', 'racism', 'metamorphosis', 'xenophobia', 'internment camp', 'body transformation', 'alien technology', 'segregation']",en,"Aliens land in South Africa and, with their ship totally disabled,  have no way home. Years later, after living in a slum and wearing out their welcome the 'Non-Humans' are being moved to a new tent city overseen by Multi-National United (MNU).",63.13678,2009-08-05,210819611,112.0,You are not welcome here.,District 9,7.3,WingNut Films,United States of America,Afrikaans
30000000,Drama,"['transporter', 'suicide attempt', 'strong woman', 'boxer', 'dying and death', 'stroke of fate', 'training', 'advancement', 'sport', 'female protagonist', 'boxing trainer', 'determination']",en,"Despondent over a painful estrangement from his daughter, trainer Frankie Dunn isn't prepared for boxer Maggie Fitzgerald to enter his life. But Maggie's determined to go pro and to convince Dunn and his cohort to help her.",70.456012,2004-12-15,216763646,132.0,"Beyond his silence, there is a past. Beyond her dreams, there is a feeling. Beyond hope, there is a memory. Beyond their journey, there is a love.",Million Dollar Baby,7.7,Lakeshore Entertainment,United States of America,English
29000000,Romance,"['poem', 'river', 'sadness', 'fight', ""love of one's life"", 'dementia', 'class', 'secret love', 'tears', 'candle', 'mailbox']",en,"An epic love story centered around an older man who reads aloud to a woman with Alzheimer's. From a faded notebook, the old man's words bring to life the story about a couple who is separated by World War II, and is then passionately reunited, seven years later, after they have taken different paths.",55.109138,2004-06-25,115603229,123.0,Behind every great love is a great story.,The Notebook,7.7,New Line Cinema,United States of America,English
30000000,Comedy,"['lovesickness', 'newspaper', 'bar', 'sister sister relationship', 'new love', 'wedding planer', 'witness', 'bride', 'bridesmaid', 'sister', 'music', 'romantic comedy', 'sibling rivalry', 'reporter', 'wedding', 'woman director']",en,Altruistic Jane finds herself facing her worst nightmare as her younger sister announces her engagement to the man Jane secretly adores.,30.695228000000004,2008-01-10,160259319,111.0,She's about to find the perfect fit.,27 Dresses,6.1,Spyglass Entertainment,United States of America,English
35000000,Comedy,"['double life', 'pop star', 'musical', 'tennessee', 'teenage girl', 'teen movie', 'teenager', 'hometown', 'famous']",en,"When Miley Stewart (aka pop-star Hannah Montana) gets too caught up in the superstar celebrity lifestyle, her dad decides it's time for a total change of scenery. But sweet nibblets! Miley must trade in all the glitz and glamour of Hollywood for some ol' blue jeans on the family farm in Tennessee, and question if she can be both Miley Stewart and Hannah Montana. With a little help from her friends – and awesome guest stars Taylor Swift, Rascal Flatts and Vanessa Williams – will she figure out whether to choose Hannah or Miley?",13.788422,2009-04-10,155545279,102.0,She has the best of both worlds...now she has to choose just one.,Hannah Montana: The Movie,6.0,Walt Disney Pictures,United States of America,English
25000000,Drama,"['suitcase', 'business', 'omaha', 'on the road', 'downsizing', 'cross country', 'duringcreditsstinger']",en,"George Clooney plays the dry cynical character of Ryan Bingham, an executive who specializes in ""downsizing"". Ryan lives out of his suitcase, traveling the country for the sole purpose terminating unwanted employees day after day. Just as Ryan is about to reach his life-long goal of the ten million mile frequent flyer mark some major changes come his way. Changes that threaten to crack the cold heartless exterior that is Ryan Bingham.",33.704181,2009-09-05,163670000,109.0,The story of a man ready to make a connection.,Up in the Air,6.7,Paramount Pictures,United States of America,English
30000000,Action,"['suicide', 'assassin', 'drug addiction', 'future', 'time travel', 'dystopia', 'retirement', 'boy', 'murder', 'organized crime', 'tragedy', 'execution', 'violence', 'criminal', 'drug addict', 'contract killer', 'neo-noir']",en,"In the futuristic action thriller Looper, time travel will be invented but it will be illegal and only available on the black market. When the mob wants to get rid of someone, they will send their target 30 years into the past where a looper, a hired gun, like Joe is waiting to mop up. Joe is getting rich and life is good until the day the mob decides to close the loop, sending back Joe's future self for assassination.",46.377628,2012-09-26,47042000,118.0,"Hunted By Your Future, Haunted By Your Past",Looper,6.6,Endgame Entertainment,China,English
30000000,Comedy,"['hawaii', 'one-night stand', 'beauty']",en,"When Sarah Marshall dumps aspiring musician Peter Bretter for rock star Aldous Snow, Peter's world comes crashing down. His best friend suggests that Peter should get away from everything and to fly off to Hawaii to escape all his problems. After arriving in Hawaii and meeting the beautiful Rachel Jansen, Peter is shocked to see not only Aldous Snow in Hawaii, but also Sarah Marshall.",50.670253,2008-04-17,105173115,111.0,"You lose some, you get some.",Forgetting Sarah Marshall,6.4,Universal Pictures,United States of America,English
45000000,Action,"['brother brother relationship', 'robbery', 'arbitrary law', 'adoptive mother', 'revenge', 'murder', 'violence', 'detroit', 'duringcreditsstinger', 'interracial adoption']",en,Four adopted brothers return to their Detroit hometown when their mother is murdered and vow to exact revenge on the killers.,24.694551,2005-08-11,92374674,109.0,They came home to bury mom... and her killer,Four Brothers,6.7,Paramount Pictures,United States of America,Español
30000000,Comedy,"['pregnancy and birth', 'surrogate mother']",en,"A successful, single businesswoman who dreams of having a baby discovers she is infertile and hires a working class woman to be her unlikely surrogate.",11.409124,2008-04-23,63833449,99.0,Would you put your eggs...in this basket?,Baby Mama,5.8,Relativity Media,United States of America,English
