budget,genres,keywords,original_language,overview,popularity,release_date,revenue,runtime,tagline,title,vote_average,companies,countries,languages
237000000,Action,"['culture clash', 'future', 'space war', 'space colony', 'society', 'space travel', 'futuristic', 'romance', 'space', 'alien', 'tribe', 'alien planet', 'cgi', 'marine', 'soldier', 'battle', 'love affair', 'anti war', 'power relations', 'mind and soul', '3d']",en,"In the 22nd century, a paraplegic Marine is dispatched to the moon Pandora on a unique mission, but becomes torn between following orders and protecting an alien civilization.",150.437577,2009-12-10,2787965087,162.0,Enter the World of Pandora.,Avatar,7.2,Ingenious Film Partners,United States of America,English
300000000,Adventure,"['ocean', 'drug abuse', 'exotic island', 'east india trading company', ""love of one's life"", 'traitor', 'shipwreck', 'strong woman', 'ship', 'alliance', 'calypso', 'afterlife', 'fighter', 'pirate', 'swashbuckler', 'aftercreditsstinger']",en,"Captain Barbossa, long believed to be dead, has come back to life and is headed to the edge of the Earth with Will Turner and Elizabeth Swann. But nothing is quite as it seems.",139.082615,2007-05-19,961000000,169.0,"At the end of the world, the adventure begins.",Pirates of the Caribbean: At World's End,6.9,Walt Disney Pictures,United States of America,English
245000000,Action,"['spy', 'based on novel', 'secret agent', 'sequel', 'mi6', 'british secret service', 'united kingdom']",en,"A cryptic message from Bond’s past sends him on a trail to uncover a sinister organization. While M battles political forces to keep the secret service alive, Bond peels back the layers of deceit to reveal the terrible truth behind SPECTRE.",107.376788,2015-10-26,880674609,148.0,A Plan No One Escapes,Spectre,6.3,Columbia Pictures,United Kingdom,Français
250000000,Action,"['dc comics', 'crime fighter', 'terrorist', 'secret identity', 'burglar', 'hostage drama', 'time bomb', 'gotham city', 'vigilante', 'cover-up', 'superhero', 'villainess', 'tragic hero', 'terrorism', 'destruction', 'catwoman', 'cat burglar', 'imax', 'flood', 'criminal underworld', 'batman']",en,"Following the death of District Attorney Harvey Dent, Batman assumes responsibility for Dent's crimes to protect the late attorney's reputation and is subsequently hunted by the Gotham City Police Department. Eight years later, Batman encounters the mysterious Selina Kyle and the villainous Bane, a new terrorist leader who overwhelms Gotham's finest. The Dark Knight resurfaces to protect a city that has branded him an enemy.",112.31295,2012-07-16,1084939099,165.0,The Legend Ends,The Dark Knight Rises,7.6,Legendary Pictures,United States of America,English
260000000,Action,"['based on novel', 'mars', 'medallion', 'space travel', 'princess', 'alien', 'steampunk', 'martian', 'escape', 'edgar rice burroughs', 'alien race', 'superhuman strength', 'mars civilization', 'sword and planet', '19th century', '3d']",en,"John Carter is a war-weary, former military captain who's inexplicably transported to the mysterious and exotic planet of Barsoom (Mars) and reluctantly becomes embroiled in an epic conflict. It's a world on the brink of collapse, and Carter rediscovers his humanity when he realizes the survival of Barsoom and its people rests in his hands.",43.926995,2012-03-07,284139100,132.0,"Lost in our world, found in another.",John Carter,6.1,Walt Disney Pictures,United States of America,English
258000000,Fantasy,"['dual identity', 'amnesia', 'sandstorm', ""love of one's life"", 'forgiveness', 'spider', 'wretch', 'death of a friend', 'egomania', 'sand', 'narcism', 'hostility', 'marvel comic', 'sequel', 'superhero', 'revenge']",en,"The seemingly invincible Spider-Man goes up against an all-new crop of villain – including the shape-shifting Sandman. While Spider-Man’s superpowers are altered by an alien organism, his alter ego, Peter Parker, deals with nemesis Eddie Brock and also gets caught up in a love triangle.",115.699814,2007-05-01,890871626,139.0,The battle within.,Spider-Man 3,5.9,Columbia Pictures,United States of America,English
260000000,Animation,"['hostage', 'magic', 'horse', 'fairy tale', 'musical', 'princess', 'animation', 'tower', 'blonde woman', 'selfishness', 'healing power', 'based on fairy tale', 'duringcreditsstinger', 'healing gift', 'animal sidekick']",en,"When the kingdom's most wanted-and most charming-bandit Flynn Rider hides out in a mysterious tower, he's taken hostage by Rapunzel, a beautiful and feisty tower-bound teen with 70 feet of magical, golden hair. Flynn's curious captor, who's looking for her ticket out of the tower where she's been locked away for years, strikes a deal with the handsome thief and the unlikely duo sets off on an action-packed escapade, complete with a super-cop horse, an over-protective chameleon and a gruff gang of pub thugs.",48.681969,2010-11-24,591794936,100.0,They're taking adventure to new lengths.,Tangled,7.4,Walt Disney Pictures,United States of America,English
280000000,Action,"['marvel comic', 'sequel', 'superhero', 'based on comic book', 'vision', 'superhero team', 'duringcreditsstinger', 'marvel cinematic universe', '3d']",en,"When Tony Stark tries to jumpstart a dormant peacekeeping program, things go awry and Earth’s Mightiest Heroes are put to the ultimate test as the fate of the planet hangs in the balance. As the villainous Ultron emerges, it is up to The Avengers to stop him from enacting his terrible plans, and soon uneasy alliances and unexpected action pave the way for an epic and unique global adventure.",134.27922900000002,2015-04-22,1405403694,141.0,A New Age Has Come.,Avengers: Age of Ultron,7.3,Marvel Studios,United States of America,English
250000000,Adventure,"['witch', 'magic', 'broom', 'school of witchcraft', 'wizardry', 'apparition', 'teenage crush', 'werewolf']",en,"As Harry begins his sixth year at Hogwarts, he discovers an old book marked as 'Property of the Half-Blood Prince', and begins to learn more about Lord Voldemort's dark past.",98.885637,2009-07-07,933959197,153.0,Dark Secrets Revealed,Harry Potter and the Half-Blood Prince,7.4,Warner Bros.,United Kingdom,English
250000000,Action,"['dc comics', 'vigilante', 'superhero', 'based on comic book', 'revenge', 'super powers', 'clark kent', 'bruce wayne', 'dc extended universe']",en,"Fearing the actions of a god-like Super Hero left unchecked, Gotham City’s own formidable, forceful vigilante takes on Metropolis’s most revered, modern-day savior, while the world wrestles with what sort of hero it really needs. And with Batman and Superman at war with one another, a new threat quickly arises, putting mankind in greater danger than it’s ever known before.",155.790452,2016-03-23,873260194,151.0,Justice or revenge,Batman v Superman: Dawn of Justice,5.7,DC Comics,United States of America,English
200000000,Adventure,"['killing', 'undercover', 'secret agent', 'british secret service']",en,"Quantum of Solace continues the adventures of James Bond after Casino Royale. Betrayed by Vesper, the woman he loved, 007 fights the urge to make his latest mission personal. Pursuing his determination to uncover the truth, Bond and M interrogate Mr. White, who reveals that the organization that blackmailed Vesper is far more complex and dangerous than anyone had imagined.",107.928811,2008-10-30,586090727,106.0,"For love, for hate, for justice, for revenge.",Quantum of Solace,6.1,Eon Productions,United Kingdom,English
200000000,Adventure,"['witch', 'fortune teller', 'bondage', 'exotic island', 'monster', 'captain', 'card game', 'east india trading company', 'compass', 'ship', 'daughter', 'pirate', 'swashbuckler', 'aftercreditsstinger']",en,"Captain Jack Sparrow works his way out of a blood debt with the ghostly Davey Jones, he also attempts to avoid eternal damnation.",145.84737900000005,2006-06-20,1065659812,151.0,Jack is back!,Pirates of the Caribbean: Dead Man's Chest,7.0,Walt Disney Pictures,Jamaica,English
255000000,Action,"['texas', 'horse', 'survivor', 'texas ranger', 'partner', 'outlaw', 'escape', 'lawyer', 'train', 'lone ranger', 'comanche', 'the lone ranger', 'tonto']",en,"The Texas Rangers chase down a gang of outlaws led by Butch Cavendish, but the gang ambushes the Rangers, seemingly killing them all. One survivor is found, however, by an American Indian named Tonto, who nurses him back to health. The Ranger, donning a mask and riding a white stallion named Silver, teams up with Tonto to bring the unscrupulous gang and others of that ilk to justice.",49.046956,2013-07-03,89289910,149.0,Never Take Off the Mask,The Lone Ranger,5.9,Walt Disney Pictures,United States of America,English
225000000,Action,"['saving the world', 'dc comics', 'superhero', 'based on comic book', 'superhuman', 'alien invasion', 'reboot', 'super powers', 'dc extended universe']",en,"A young boy learns that he has extraordinary powers and is not of this earth. As a young man, he journeys to discover where he came from and what he was sent here to do. But the hero in him must emerge if he is to save the world from annihilation and become the symbol of hope for all mankind.",99.398009,2013-06-12,662845518,143.0,You will believe that a man can fly.,Man of Steel,6.5,Legendary Pictures,United Kingdom,English
220000000,Science Fiction,"['new york', 'shield', 'marvel comic', 'superhero', 'based on comic book', 'alien invasion', 'superhero team', 'aftercreditsstinger', 'duringcreditsstinger', 'marvel cinematic universe']",en,"When an unexpected enemy emerges and threatens global safety and security, Nick Fury, director of the international peacekeeping agency known as S.H.I.E.L.D., finds himself in need of a team to pull the world back from the brink of disaster. Spanning the globe, a daring recruitment effort begins!",144.448633,2012-04-25,1519557910,143.0,Some assembly required.,The Avengers,7.4,Paramount Pictures,United States of America,English
380000000,Adventure,"['sea', 'captain', 'mutiny', 'sword', 'prime minister', 'sailing', 'silver', 'ship', 'duke', 'mermaid', 'pirate', 'soldier', 'battle', 'swashbuckler', 'aftercreditsstinger', '3d']",en,"Captain Jack Sparrow crosses paths with a woman from his past, and he's not sure if it's love -- or if she's a ruthless con artist who's using him to find the fabled Fountain of Youth. When she forces him aboard the Queen Anne's Revenge, the ship of the formidable pirate Blackbeard, Jack finds himself on an unexpected adventure in which he doesn't know who to fear more: Blackbeard or the woman from his past.",135.413856,2011-05-14,1045713802,136.0,Live Forever Or Die Trying.,Pirates of the Caribbean: On Stranger Tides,6.4,Walt Disney Pictures,United States of America,English
225000000,Action,"['time travel', 'time machine', 'alien', 'fictional government agency', 'seeing the future', 'changing history']",en,"Agents J (Will Smith) and K (Tommy Lee Jones) are back...in time. J has seen some inexplicable things in his 15 years with the Men in Black, but nothing, not even aliens, perplexes him as much as his wry, reticent partner. But when K's life and the fate of the planet are put at stake, Agent J will have to travel back in time to put things right. J discovers that there are secrets to the universe that K never told him - secrets that will reveal themselves as he teams up with the young Agent K (Josh Brolin) to save his partner, the agency, and the future of humankind.",52.035179,2012-05-23,624026776,106.0,They are back... in time.,Men in Black 3,6.2,Amblin Entertainment,United States of America,English
250000000,Action,"['corruption', 'elves', 'dwarves', 'orcs', 'middle-earth (tolkien)', 'hobbit', 'dragon', 'battle', 'unlikely friendship', 'epic battle', 'sword and sorcery']",en,"Immediately after the events of The Desolation of Smaug, Bilbo and the dwarves try to defend Erebor's mountain of treasure from others who claim it: the men of the ruined Laketown and the elves of Mirkwood. Meanwhile an army of Orcs led by Azog the Defiler is marching on Erebor, fueled by the rise of the dark lord Sauron. Dwarves, elves and men must unite, and the hope for Middle-Earth falls into Bilbo's hands.",120.965743,2014-12-10,956019788,144.0,Witness the defining chapter of the Middle-Earth saga,The Hobbit: The Battle of the Five Armies,7.1,WingNut Films,New Zealand,English
215000000,Action,"['loss of father', 'vigilante', 'serum', 'marvel comic', 'scientific experiment', 'spider bite', 'masked vigilante', 'reboot', 'super powers', 'genetic engineering', 'social outcast', 'duringcreditsstinger']",en,"Peter Parker is an outcast high schooler abandoned by his parents as a boy, leaving him to be raised by his Uncle Ben and Aunt May. Like most teenagers, Peter is trying to figure out who he is and how he got to be the person he is today. As Peter discovers a mysterious briefcase that belonged to his father, he begins a quest to understand his parents' disappearance – leading him directly to Oscorp and the lab of Dr. Curt Connors, his father's former partner. As Spider-Man is set on a collision course with Connors' alter ego, The Lizard, Peter will make life-altering choices to use his powers and shape his destiny to become a hero.",89.866276,2012-06-27,752215857,136.0,The untold story begins.,The Amazing Spider-Man,6.5,Columbia Pictures,United States of America,English
200000000,Action,"['robin hood', 'archer', 'knight', 'sherwood forest', 'bow and arrow', 'middle ages', 'medieval', 'king of england']",en,"When soldier Robin happens upon the dying Robert of Loxley, he promises to return the man's sword to his family in Nottingham. There, he assumes Robert's identity; romances his widow, Marion; and draws the ire of the town's sheriff and King John's henchman, Godfrey.",37.668301,2010-05-12,310669540,140.0,"Rise and rise again, until lambs become lions.",Robin Hood,6.2,Imagine Entertainment,United Kingdom,English
250000000,Adventure,"['elves', 'dwarves', 'orcs', 'hobbit', 'dragon', 'wizard', 'sword and sorcery']",en,"The Dwarves, Bilbo and Gandalf have successfully escaped the Misty Mountains, and Bilbo has gained the One Ring. They all continue their journey to get their gold back from the Dragon, Smaug.",94.370564,2013-12-11,958400000,161.0,Beyond darkness... beyond desolation... lies the greatest danger of all.,The Hobbit: The Desolation of Smaug,7.6,WingNut Films,New Zealand,English
180000000,Adventure,"['england', 'compass', 'experiment', 'lordship', 'uncle', 'polar bear', 'orphan', 'animal', 'based on young adult novel']",en,"After overhearing a shocking secret, precocious orphan Lyra Belacqua trades her carefree existence roaming the halls of Jordan College for an otherworldly adventure in the far North, unaware that it's part of her destiny.",42.990906,2007-12-04,372234864,113.0,There are worlds beyond our own - the compass will show the way.,The Golden Compass,5.8,New Line Cinema,United Kingdom,Íslenska
200000000,Drama,"['shipwreck', 'iceberg', 'ship', 'panic', 'titanic', 'ocean liner', 'epic', 'rich woman - poor man', 'love', 'disaster', 'tragic love', 'class differences', 'imax', 'star crossed lovers', 'steerage', 'salvage', 'rich snob', '3d', '1910s']",en,"84 years later, a 101-year-old woman named Rose DeWitt Bukater tells the story to her granddaughter Lizzy Calvert, Brock Lovett, Lewis Bodine, Bobby Buell and Anatoly Mikailavich on the Keldysh about her life set in April 10th 1912, on a ship called Titanic when young Rose boards the departing ship with the upper-class passengers and her mother, Ruth DeWitt Bukater, and her fiancé, Caledon Hockley. Meanwhile, a drifter and artist named Jack Dawson and his best friend Fabrizio De Rossi win third-class tickets to the ship in a game. And she explains the whole story from departure until the death of Titanic on its first and last voyage April 15th, 1912 at 2:20 in the morning.",100.025899,1997-11-18,1845034188,194.0,Nothing on Earth could come between them.,Titanic,7.5,Paramount Pictures,United States of America,English
250000000,Adventure,"['civil war', 'war', 'marvel comic', 'sequel', 'superhero', 'based on comic book', 'imax', 'aftercreditsstinger', 'duringcreditsstinger', 'marvel cinematic universe', '3d']",en,"Following the events of Age of Ultron, the collective governments of the world pass an act designed to regulate all superhuman activity. This polarizes opinion amongst the Avengers, causing two factions to side with Iron Man or Captain America, which causes an epic battle between former allies.",198.372395,2016-04-27,1153304495,147.0,Divided We Fall,Captain America: Civil War,7.1,Studio Babelsberg,United States of America,Română
150000000,Action,"['monster', 'dna', 'tyrannosaurus rex', 'velociraptor', 'island', 'sequel', 'suspense', 'disaster', 'escape', 'dinosaur', 'amusement park', 'animal attack', 'theme park', 'jurassic park', '3d', 'animal horror']",en,"Twenty-two years after the events of Jurassic Park, Isla Nublar now features a fully functioning dinosaur theme park, Jurassic World, as originally envisioned by John Hammond.",418.708552,2015-06-09,1513528810,124.0,The park is open.,Jurassic World,6.5,Universal Studios,United States of America,English
200000000,Action,"['spy', 'secret agent', 'sociopath', 'killer', 'art gallery', 'british secret service', 'istanbul turkey', 'imax', 'uzi', 'booby trap', 'impersonating a police officer', 'macao']",en,"When Bond's latest assignment goes gravely wrong and agents around the world are exposed, MI6 is attacked forcing M to relocate the agency. These events cause her authority and position to be challenged by Gareth Mallory, the new Chairman of the Intelligence and Security Committee. With MI6 now compromised from both inside and out, M is left with one ally she can trust: Bond. 007 takes to the shadows - aided only by field agent, Eve - following a trail to the mysterious Silva, whose lethal and hidden motives have yet to reveal themselves.",93.004993,2012-10-25,1108561013,143.0,Think on your sins.,Skyfall,6.9,Columbia Pictures,United Kingdom,English
200000000,Action,"['dual identity', ""love of one's life"", 'pizza boy', 'marvel comic', 'sequel', 'superhero', 'doctor', 'scientist', 'tentacle', 'death', 'super villain']",en,"Peter Parker is going through a major identity crisis. Burned out from being Spider-Man, he decides to shelve his superhero alter ego, which leaves the city suffering in the wake of carnage left by the evil Doc Ock. In the meantime, Parker still can't act on his feelings for Mary Jane Watson, a girl he's loved since childhood.",35.149586,2004-06-25,783766341,127.0,There's a hero in all of us.,Spider-Man 2,6.7,Columbia Pictures,United States of America,English
200000000,Action,"['terrorist', 'war on terror', 'tennessee', 'malibu', 'marvel comic', 'superhero', 'based on comic book', 'tony stark', 'iron man', 'aftercreditsstinger', 'marvel cinematic universe', 'mandarin', '3d', 'war machine', 'iron patriot', 'extremis']",en,"When Tony Stark's world is torn apart by a formidable terrorist called the Mandarin, he starts an odyssey of rebuilding and retribution.",77.68208,2013-04-18,1215439994,130.0,Unleash the power behind the armor.,Iron Man 3,6.8,Marvel Studios,China,English
200000000,Family,"['based on novel', 'fictional place', 'queen', 'fantasy', 'alice in wonderland', 'fantasy world', '3d']",en,"Alice, an unpretentious and individual 19-year-old, is betrothed to a dunce of an English nobleman. At her engagement party, she escapes the crowd to consider whether to go through with the marriage and falls down a hole in the garden after spotting an unusual rabbit. Arriving in a strange and surreal place called 'Underland,' she finds herself in a world that resembles the nightmares she had as a child, filled with talking animals, villainous queens and knights, and frumious bandersnatches. Alice realizes that she is there for a reason – to conquer the horrific Jabberwocky and restore the rightful queen to her throne.",78.530105,2010-03-03,1025491110,108.0,You're invited to a very important date.,Alice in Wonderland,6.4,Walt Disney Pictures,United States of America,English
150000000,Science Fiction,"['egypt', 'sun', 'chaos', 'symbol', 'artifact', 'transformers', 'tank', 'robot', 'imax', 'duringcreditsstinger']",en,"Sam Witwicky leaves the Autobots behind for a normal life. But when his mind is filled with cryptic symbols, the Decepticons target him and he is dragged back into the Transformers' war.",21.939663,2009-06-19,836297228,150.0,Revenge is coming.,Transformers: Revenge of the Fallen,6.0,Paramount Pictures,United States of America,English
210000000,Science Fiction,"['sequel', 'alien', 'transformers', 'giant robot', 'robot', 'imax', 'transforming robot']",en,"As humanity picks up the pieces, following the conclusion of ""Transformers: Dark of the Moon,"" Autobots and Decepticons have all but vanished from the face of the planet. However, a group of powerful, ingenious businessman and scientists attempt to learn from past Transformer incursions and push the boundaries of technology beyond what they can control - all while an ancient, powerful Transformer menace sets Earth in his cross-hairs.",116.840296,2014-06-25,1091405097,165.0,This is not war. It's extinction.,Transformers: Age of Extinction,5.8,Paramount Pictures,United States of America,English
200000000,Fantasy,"['circus', 'witch', 'magic', 'hope', 'illusion', 'lost', 'magic trick', 'wizard', '3d']",en,"Oscar Diggs, a small-time circus illusionist and con-artist, is whisked from Kansas to the Land of Oz where the inhabitants assume he's the great wizard of prophecy, there to save Oz from the clutches of evil.",46.985445,2013-03-07,491868548,130.0,"In Oz, nothing is what it seems",Oz: The Great and Powerful,5.7,Walt Disney Pictures,United States of America,English
200000000,Action,"['obsession', 'marvel comic', 'sequel', 'based on comic book', 'electrocution', 'medical experiment', 'electricity', 'super powers']",en,"For Peter Parker, life is busy. Between taking out the bad guys as Spider-Man and spending time with the person he loves, Gwen Stacy, high school graduation cannot come quickly enough. Peter has not forgotten about the promise he made to Gwen’s father to protect her by staying away, but that is a promise he cannot keep. Things will change for Peter when a new villain, Electro, emerges, an old friend, Harry Osborn, returns, and Peter uncovers new clues about his past.",89.270217,2014-04-16,705717432,142.0,No more secrets.,The Amazing Spider-Man 2,6.5,Columbia Pictures,United States of America,English
170000000,Adventure,"['artificial intelligence', 'secret identity', 'computer program', 'dystopia', 'computer', 'deception', 'duel', 'motorcycle', 'neon light', 'autocracy']",en,"Sam Flynn, the tech-savvy and daring son of Kevin Flynn, investigates his father's disappearance and is pulled into The Grid. With the help of a mysterious program named Quorra, Sam quests to stop evil dictator Clu from crossing into the real world.",73.79505,2010-12-10,400062763,125.0,The Game Has Changed.,TRON: Legacy,6.3,Walt Disney Pictures,United States of America,English
200000000,Animation,"['car race', 'sequel', 'comedy', 'anthropomorphism', 'best friend', 'duringcreditsstinger']",en,Star race car Lightning McQueen and his pal Mater head overseas to compete in the World Grand Prix race. But the road to the championship becomes rocky as Mater gets caught up in an intriguing adventure of his own: international espionage.,49.98659,2011-06-11,559852396,106.0,Ka-ciao!,Cars 2,5.8,Walt Disney Pictures,United States of America,English
200000000,Adventure,"['dc comics', 'transformation', 'superhero', 'alien', 'alien infection', 'magical object', 'protector', 'super powers', 'origin', '3d']",en,"For centuries, a small but powerful force of warriors called the Green Lantern Corps has sworn to keep intergalactic order. Each Green Lantern wears a ring that grants him superpowers. But when a new enemy called Parallax threatens to destroy the balance of power in the Universe, their fate and the fate of Earth lie in the hands of the first human ever recruited.",51.872839,2011-06-16,219851172,114.0,"In our darkest hour, there will be light.",Green Lantern,5.1,De Line Pictures,United States of America,English
200000000,Animation,"['hostage', 'college', 'toy', 'barbie', 'animation', 'escape', 'day care', 'teddy bear', 'duringcreditsstinger', 'toy comes to life', 'personification', 'inanimate objects coming to life', 'toy story']",en,"Woody, Buzz, and the rest of Andy's toys haven't been played with in years. With Andy about to go to college, the gang find themselves accidentally left at a nefarious day care center. The toys must band together to escape and return home to Andy.",59.99541800000001,2010-06-16,1066969703,103.0,No toy gets left behind.,Toy Story 3,7.6,Walt Disney Pictures,United States of America,English
200000000,Action,"['saving the world', 'artificial intelligence', 'prophecy', 'san francisco', 'cyborg', 'killer robot', 'gas station', 'post-apocalyptic', 'dystopia', 'army', 'firearm', 'wartime', 'los angeles']",en,"All grown up in post-apocalyptic 2018, John Connor must lead the resistance of humans against the increasingly dominating militaristic robots. But when Marcus Wright appears, his existence confuses the mission as Connor tries to determine whether Wright has come from the future or the past -- and whether he's friend or foe.",71.862892,2009-05-20,371353001,115.0,The End Begins.,Terminator Salvation,5.9,Columbia Pictures,Germany,English
190000000,Action,"['car race', 'speed', 'revenge', 'suspense', 'car', 'race', 'muscle car']",en,Deckard Shaw seeks revenge against Dominic Toretto and his family for his comatose brother.,102.322217,2015-04-01,1506249360,137.0,Vengeance Hits Home,Furious 7,7.3,Universal Pictures,Japan,English
