budget,genres,keywords,original_language,overview,popularity,release_date,revenue,runtime,tagline,title,vote_average,companies,countries,languages
75000000,Comedy,"['comedian', 'cancer', 'bromance', 'stand-up comedian']",en,"Famous and wealthy funnyman George Simmons doesn't give much thought to how he treats people until a doctor delivers stunning health news, forcing George to reevaluate his priorities with a little help from aspiring stand-up comic Ira.",20.199057,2009-07-31,61458982,146.0,"George Simmons was prepared to die, but then a funny thing happened.",Funny People,5.7,Columbia Pictures,United States of America,English
70000000,Thriller,"['assassination', 'assassin', 'terrorist', 'explosive', 'fbi', 'chase', 'saudi arabia', 'investigation', 'police', 'medical examiner', 'terrorism', 'fbi agent', 'arab', 'bomb attack']",en,A team of U.S. government agents is sent to investigate the bombing of an American facility in the Middle East.,26.123705,2007-08-22,86658558,110.0,How do you stop an enemy who isn't afraid to die?,The Kingdom,6.5,Universal Pictures,Germany,العربية
72500000,Comedy,"['north carolina', 'prayer', 'family dinner', 'advertising', 'divorce', 'motor', 'automobile racing', 'nascar', 'dog trainer', 'car movie', 'sport competition', 'psychosomatic illness', 'french stereotype', 'aftercreditsstinger', 'duringcreditsstinger']",en,"Lifelong friends and national idols Ricky Bobby and Cal Naughton Jr. have earned their NASCAR stripes with their uncanny knack of finishing races in the first and second slots, respectively, and slinging catchphrases like ""Shake and bake!"" But when a rival French driver coasts onto the track to challenge their records, they'll have to floor it to retain their top-dog status.",12.599836,2006-08-04,162966177,116.0,The story of a man who could only count to #1,Talladega Nights: The Ballad of Ricky Bobby,6.2,Columbia Pictures,United States of America,English
75000000,Animation,"['father son relationship', 'lake', 'springfield', 'the simpsons', 'duff beer', 'garbage', 'pig', 'pollution', 'environmental protection agency', 'quarantine', 'alcoholism', 'love', 'alaska', 'dysfunctional family', 'dysfunctional marriage', 'ecology', 'saving lives', 'first love', 'duringcreditsstinger', 'donuts']",en,"After Homer accidentally pollutes the town's water supply, Springfield is encased in a gigantic dome by the EPA and the Simpsons are declared fugitives.",46.875375,2007-07-25,527068851,87.0,See our family. And feel better about yours.,The Simpsons Movie,6.9,Gracie Films,United States of America,English
150000000,Adventure,"['prison', 'magic', 'liberation', 'honeymoon', 'parents-in-law', 'kingdom', 'enchantment', 'dancing scene', 'transformation', 'fairy-tale figure']",en,"Shrek, Fiona and Donkey set off to Far, Far Away to meet Fiona's mother and father. But not everyone is happy. Shrek and the King find it hard to get along, and there's tension in the marriage. The fairy godmother discovers that Shrek has married Fiona instead of her Son Prince Charming and sets about destroying their marriage.",47.320801,2004-05-19,919838758,93.0,Once upon another time...,Shrek 2,6.7,DreamWorks SKG,United States of America,English
120000000,Animation,"['car race', 'car journey', 'village and town', 'auto', 'route 66', 'wrecker', 'porsche', 'retirement', 'media', 'friendship', 'sport', 'anthropomorphism', 'los angeles', 'road movie', 'aftercreditsstinger', 'duringcreditsstinger']",en,"Lightning McQueen, a hotshot rookie race car driven to succeed, discovers that life is about the journey, not the finish line, when he finds himself unexpectedly detoured in the sleepy Route 66 town of Radiator Springs. On route across the country to the big Piston Cup Championship in California to compete against two seasoned pros, McQueen gets to know the town's offbeat characters.",82.643036,2006-06-08,461983149,117.0,Ahhh... it's got that new movie smell.,Cars,6.6,Walt Disney Pictures,United States of America,English
70000000,Action,"['sports car', 'biological weapon', 'cold war', 'russian', 'prague', 'mission', 'athlete', 'nsa agent', 'adrenaline junkie', 'thrill seeker']",en,"Xander Cage is your standard adrenaline junkie with no fear and a lousy attitude. When the US Government ""recruits"" him to go on a mission, he's not exactly thrilled. His mission: to gather information on an organization that may just be planning the destruction of the world, led by the nihilistic Yorgi.",46.217769,2002-08-09,277448382,124.0,A New Breed Of Secret Agent.,xXx,5.8,Columbia Pictures,United States of America,Český
74000000,Animation,"['ocean', 'sea', 'star', 'water', 'comedy', 'sponge', 'spongebob', 'live action and animation']",en,"Burger Beard is a pirate who is in search of the final page of a magical book that makes any evil plan he writes in it come true, which happens to be the Krabby Patty secret formula. When the entire city of Bikini Bottom is put in danger, SpongeBob, Patrick, Mr. Krabs, Squidward, Sandy, and Plankton need to go on a quest that takes them to the surface. In order to get back the recipe and save their city, the gang must retrieve the book and transform themselves into superheroes.",36.952268,2015-02-05,311594032,93.0,He's leaving his world behind.,The SpongeBob Movie: Sponge Out of Water,5.8,Paramount Pictures,United States of America,English
70000000,Drama,"['paris', 'guerrilla', 'cinema', 'self sacrifice', 'dynamite', 'mexican standoff', 'world war ii', 'jew persecution', 'jew', 'nazis', 'masochism', 'sadism', 'scalp', 'winston churchill', 'knife in hand', 'anti semitism', 'gore', 'swastika', 'blood bath', 'german occupation of france', 'violence', 'gun violence']",en,"In Nazi-occupied France during World War II, a group of Jewish-American soldiers known as ""The Basterds"" are chosen specifically to spread fear throughout the Third Reich by scalping and brutally killing Nazis. The Basterds, lead by Lt. Aldo Raine soon cross paths with a French-Jewish teenage girl who runs a movie theater in Paris which is targeted by the soldiers.",72.595961,2009-08-18,319131050,153.0,Once upon a time in Nazi occupied France...,Inglourious Basterds,7.9,Universal Pictures,Germany,Deutsch
80000000,Action,"['liberation', 'transport of prisoners', 'special unit', 'weapon', 'los angeles']",en,"Hondo Harrelson recruits Jim Street to join an elite unit of the Los Angeles Police Department. Together they seek out more members, including tough Deke Kay and single mom Chris Sanchez. The team's first big assignment is to escort crime boss Alex Montel to prison. It seems routine, but when Montel offers a huge reward to anyone who can break him free, criminals of various stripes step up for the prize.",34.052253,2003-08-08,116643346,117.0,You're either S.W.A.T. or you're not.,S.W.A.T.,5.8,Original Film,United States of America,English
70000000,Adventure,"['saving the world', 'predator', 'laserpointer', 'space marine', 'pyramid', 'praise', 'alien', 'xenomorph']",en,"When scientists discover something in the Arctic that appears to be a buried Pyramid, they send a research team out to investigate. Little do they know that they are about to step into a hunting ground where Aliens are grown as sport for the Predator race.",42.957216,2004-08-12,171183863,101.0,Whoever wins... We lose,AVP: Alien vs. Predator,5.5,Impact Pictures,Canada,Italiano
75000000,Comedy,"['chipmunk', 'cgi', 'based on tv series', 'aftercreditsstinger', 'duringcreditsstinger', 'woman director']",en,"Pop sensations Alvin, Simon and Theodore end up in the care of Dave Seville's twenty-something nephew Toby. The boys must put aside music super stardom to return to school, and are tasked with saving the school's music program by winning the $25,000 prize in a battle of the bands. But the Chipmunks unexpectedly meet their match in three singing chipmunks known as The Chipettes - Brittany, Eleanor and Jeanette. Romantic and musical sparks are ignited when the Chipmunks and Chipettes square off.",29.412262,2009-12-21,443140005,88.0,The Boys are back in town... and they have competition.,Alvin and the Chipmunks: The Squeakquel,5.4,Regency Enterprises,United States of America,English
70000000,Action,"['saving the world', 'hero', 'marine corps', 'chaos', 'retirement', 'survivor', 'meteor', 'space invasion', 'alien', 'battlefield', 'survival', 'sergeant', 'los angeles', 'battle', 'danger', 'escapade', 'u.s. marine', 'heroic mission', 'evil alien', 'chaos and mayham']",en,"The Earth is attacked by unknown forces. As people everywhere watch the world's great cities fall, Los Angeles becomes the last stand for mankind in a battle no one expected. It's up to a Marine staff sergeant and his new platoon to draw a line in the sand as they take on an enemy unlike any they've ever encountered before.",49.199234,2011-03-08,202466756,116.0,It's not war. It's survival.,Battle: Los Angeles,5.5,Columbia Pictures,United States of America,English
66000000,Drama,"['world war i', 'horse', 'farm life', 'execution', 'trapped', 'alcoholic', 'cavalry', 'plowing', 'artillery']",en,"Follows a young man named Albert and his horse, Joey, and how their bond is broken when Joey is sold to the cavalry and sent to the trenches of World War One. Despite being too young to enlist, Albert heads to France to save his friend.",29.505574,2011-12-25,177584879,146.0,Separated by War. Tested by Battle. Bound by Friendship.,War Horse,7.0,DreamWorks SKG,United States of America,English
70000000,War,"['world war ii', 'nazis', 'art theft', 'post world war ii']",en,"Based on the true story of the greatest treasure hunt in history, The Monuments Men is an action drama focusing on seven over-the-hill, out-of-shape museum directors, artists, architects, curators, and art historians who went to the front lines of WWII to rescue the world’s artistic masterpieces from Nazi thieves and return them to their rightful owners.  With the art hidden behind enemy lines, how could these guys hope to succeed?",43.873266,2014-01-24,154984035,118.0,It was the greatest art heist in history,The Monuments Men,5.8,Columbia Pictures,Germany,English
70000000,Drama,['duringcreditsstinger'],en,"As the global economy teeters on the brink of disaster, a young Wall Street trader partners with disgraced former Wall Street corporate raider Gordon Gekko on a two tiered mission: To alert the financial community to the coming doom, and to find out who was responsible for the death of the young trader's mentor.",23.25645,2010-09-02,134748021,133.0,Gordon never gives up.,Wall Street: Money Never Sleeps,5.8,Twentieth Century Fox Film Corporation,United States of America,English
70000000,Adventure,"['witch', 'based on novel', 'new love', 'prince', 'beauty', 'star', 'kingdom', 'wall', 'falling star', 'royalty', 'unrequited love', 'good vs evil', 'fratricide']",en,"In a countryside town bordering on a magical land, a young man makes a promise to his beloved that he'll retrieve a fallen star by venturing into the magical realm. His journey takes him into a world beyond his wildest dreams and reveals his true identity.",48.03273400000001,2007-08-09,135560026,127.0,This Summer A Star Falls. The Chase Begins.,Stardust,7.1,Paramount Pictures,Iceland,English
70000000,Comedy,"['adultery', 'infidelity', 'secret', 'investigation', 'friendship', 'partner', 'love', 'friends', 'dilemma', 'cheating on partner', 'best friend']",en,"Longtime friends Ronny and Nick are partners in an auto-design firm. They are hard at work on a presentation for a dream project that would really launch their company. Then Ronny spots Nick's wife out with another man, and in the process of investigating the possible affair, he learns that Nick has a few secrets of his own. As the presentation nears, Ronny agonizes over what might happen if the truth gets out.",14.780634,2011-01-13,67112664,111.0,Two best friends. Nothing could come between them... or could it?,The Dilemma,5.2,Imagine Entertainment,United States of America,English
70000000,Fantasy,"['vampire', 'daughter', 'hybrid', 'child vampire', 'werewolf', 'imax', 'lab experiment', 'werewolf child', 'fang vamp']",en,"After being held in a coma-like state for fifteen years, vampire Selene learns that she has a fourteen-year-old vampire/Lycan hybrid daughter named Nissa, and when she finds her, they must stop BioCom from creating super Lycans that will kill them all.",58.40120400000001,2012-01-19,160112671,88.0,Vengeance Returns,Underworld: Awakening,6.1,Lakeshore Entertainment,United States of America,English
75000000,Comedy,"['musical', 'rocker', 'teenager', 'young love', 'rock sta']",en,"A small town girl and a city boy meet on the Sunset Strip, while pursuing their Hollywood dreams.",23.515938,2012-06-13,59418613,123.0,Nothin' but a good time,Rock of Ages,6.0,New Line Cinema,United States of America,English
75000000,Adventure,"['cold', 'flu', 'lethal virus', 'construction worker']",en,"A policeman white blood cell, with the help of a cold pill, must stop a deadly virus from destroying the human they live in, Frank.",10.54544,2001-08-07,13596911,95.0,Every BODY needs a hero,Osmosis Jones,5.9,Conundrum Entertainment,United States of America,English
70000000,Crime,"['terrorist', 'technology', 'anti hero', 'hacker', 'computer virus', 'national security agency (nsa)', 'race against time', 'computer', 'malaysia', 'nuclear power plant', 'suspense', 'betrayal', 'conspiracy', 'on the run', 'fugitive', 'shootout', 'hacking', 'terrorism', 'cat and mouse', 'one against many', 'computer hacker', 'no opening credits', 'terrorist plot', 'stock exchange', 'cybercrime', 'cyber terrorism', 'chinese military', 'cyber terrorist', 'cyber thriller']",en,A man is released from prison to help American and Chinese authorities pursue a mysterious cyber criminal. The dangerous search leads them from Chicago to Hong Kong.,46.832372,2015-01-13,17752940,133.0,We are no longer in control.,Blackhat,5.1,Universal Pictures,United States of America,English
70000000,Mystery,"['london england', 'himalaya', 'journalist', 'killer robot', 'computer war', 'robot']",en,"When gigantic robots attack New York City, ""Sky Captain"" uses his private air force to fight them off. His ex-girlfriend, reporter Polly Perkins, has been investigating the recent disappearance of prominent scientists. Suspecting a link between the global robot attacks and missing men, Sky Captain and Polly decide to work together. They fly to the Himalayas in pursuit of the mysterious Dr. Totenkopf, the mastermind behind the robots.",24.664776,2004-09-17,57958696,107.0,Who will save us?,Sky Captain and the World of Tomorrow,5.7,Paramount Pictures,United Kingdom,
50000000,Action,"['prison', 'muslim', 'ship', 'mystery', 'science fiction', 'escape', 'crime', 'prison escape', 'cia agent']",en,"Ray Breslin is the world's foremost authority on structural security. After analyzing every high security prison and learning a vast array of survival skills so he can design escape-proof prisons, his skills are put to the test. He's framed and incarcerated in a master prison he designed himself. He needs to escape and find the person who put him behind bars.",44.478043,2013-10-09,122915111,115.0,No one breaks out alone.,Escape Plan,6.7,Summit Entertainment,United States of America,English
68000000,Thriller,"['cia', 'terrorist', 'atomic bomb', 'cold war', 'nuclear explosion', 'jack ryan']",en,"When the president of Russia suddenly dies, a man whose politics are virtually unknown succeeds him. The change in political leaders sparks paranoia among American CIA officials, so CIA director Bill Cabot recruits a young analyst to supply insight and advice on the situation. Then the unthinkable happens: a nuclear bomb explodes in a U.S. city, and America is quick to blame the Russians.",22.392544,2002-05-31,193000000,124.0,"27,000 nuclear weapons. One is missing.",The Sum of All Fears,5.9,Paramount Pictures,United States of America,العربية
68000000,Adventure,"['vampire', 'graduation', 'bite', 'immortality', 'werewolf', 'fang vamp']",en,"Bella once again finds herself surrounded by danger as Seattle is ravaged by a string of mysterious killings and a malicious vampire continues her quest for revenge. In the midst of it all, she is forced to choose between her love for Edward and her friendship with Jacob, knowing that her decision has the potential to ignite the ageless struggle between vampire and werewolf. With her graduation quickly approaching, Bella is confronted with the most important decision of her life.",107.069763,2010-06-23,698491347,124.0,It all begins ... With a choice.,The Twilight Saga: Eclipse,5.8,Summit Entertainment,United States of America,English
69000000,Animation,"['adoptive father', 'orphanage', ""life's dream"", 'rivalry', 'stealing', 'ballet', 'little girl', 'orphan', 'father daughter relationship', 'tomboy', 'mother son relationship', 'intelligent', 'kids', 'evil doctor', 'duringcreditsstinger', 'minions', 'supervillain', '3d', 'despicable', 'cattivissimo']",en,"Villainous Gru lives up to his reputation as a despicable, deplorable and downright unlikable guy when he hatches a plan to steal the moon from the sky. But he has a tough time staying on task after three orphans land in his care.",113.858273,2010-07-08,543513985,95.0,Superbad. Superdad.,Despicable Me,7.1,Universal Pictures,United States of America,English
70000000,Adventure,"['christianity', 'philosophy', 'egypt', 'new love', 'war', 'cult', 'historical figure', 'history', 'sword fight', 'ancient world', 'destiny', 'fall in love', 'hypatia', 'misogyny', 'persecution', 'library of alexandria', 'political unrest', 'impossible love', 'false history', 'power relations', 'unfulfillment', 'master and servant', 'love and romance', 'unfulfilled love']",en,"A historical drama set in Roman Egypt, concerning philosopher Hypatia of Alexandria and her relationship with her slave Davus, who is torn between his love for her and the possibility of gaining his freedom by joining the rising tide of Christianity.",18.888806,2009-05-17,39041505,127.0,"Alexandria, Egypt. 391 A.D. The World Changed Forever.",Agora,6.9,Himenóptero,Spain,English
36000000,Comedy,"['wife husband relationship', 'daydream', 'marriage', 'freedom', 'friends']",en,"When best buds Rick and Fred begin to show signs of restlessness at home, their wives take a bold approach to revitalize their marriages: they grant the guys a ""hall pass"", one week of freedom to do whatever they want. At first, it seems like a dream come true, but they quickly discover that their expectations of the single life - and themselves - are completely and hilariously out of sync with reality.",27.115890000000004,2011-02-25,83160734,105.0,"One Week, No Rules",Hall Pass,5.4,New Line Cinema,United States of America,English
80000000,Action,"['coast guard', 'based on true story', 'survival', 'rescue mission', 'storm at sea', 'sinking ship', '1950s', '3d']",en,The Coast Guard makes a daring rescue attempt off the coast of Cape Cod after a pair of oil tankers are destroyed during a blizzard in 1952.,28.223664000000007,2016-01-25,52099090,114.0,"32 survivors, room for 12.",The Finest Hours,6.3,Walt Disney Pictures,United States of America,English
70000000,Action,"['terror', 'falsely accused', 'based on novel', 'dying and death', 'jordan', 'dubai', 'intelligence agency', 'beating']",en,"The CIA’s hunt is on for the mastermind of a wave of terrorist attacks. Roger Ferris is the agency’s man on the ground, moving from place to place, scrambling to stay ahead of ever-shifting events. An eye in the sky – a satellite link – watches Ferris.  At the other end of that real-time link is the CIA’s Ed Hoffman, strategizing events from thousands of miles away. And as Ferris nears the target, he discovers trust can be just as dangerous as it is necessary for survival.",37.507136,2008-10-10,113280098,128.0,Trust no one. Deceive everyone.,Body of Lies,6.5,Scott Free Productions,United States of America,العربية
69000000,Comedy,"['mouse', 'idiot', 'mind control', 'taxidermy', 'aftercreditsstinger', 'duringcreditsstinger']",en,"Rising executive Tim Wagner works for a boss who hosts a monthly dinner in which the guest who brings the biggest buffoon gets a career-boost. Tim plans on not attending until he meets Barry, a man who builds dioramas using stuffed mice. Barry's blundering but good intentions send Tim's life into a downward spiral, threatening a major business deal and possibly scuttling Tim's engagement to his fiancee.",11.023691,2010-07-30,86387857,114.0,Takes One To Know One.,Dinner for Schmucks,5.5,Paramount Pictures,United States of America,English
66000000,Romance,"['london england', ""new year's eve"", 'skyscraper', 'burglar', 'distrust', 'undercover', 'blackmail', 'nudity', 'thief', 'heist', 'older man younger woman relationship', 'art thief', 'criminal', 'art theft', 'millennium', 'manhattan, new york city', 'gala', 'kuala lumpur malaysia']",en,"Two thieves, who travel in elegant circles, try to outsmart each other and, in the process, end up falling in love.",25.877794,1999-04-29,212404396,112.0,The trap is set.,Entrapment,6.0,Fountainbridge Films,United Kingdom,English
59000000,Animation,"['human evolution', 'parents kids relationship', 'squirrel', 'ice', 'loss of child', 'mammoth', 'sloth', 'dying and death', 'stone age', 'prehistoric', 'saber-toothed tiger', 'cavemen', 'prehistoric creature', 'prehistoric adventure', 'prehistoric times', 'prehistoric man']",en,"With the impending ice age almost upon them, a mismatched trio of prehistoric critters – Manny the woolly mammoth, Diego the saber-toothed tiger and Sid the giant sloth – find an orphaned infant and decide to return it to its human parents. Along the way, the unlikely allies become friends but, when enemies attack, their quest takes on far nobler aims.",99.561972,2002-03-10,383257136,81.0,They came. They thawed. They conquered.,Ice Age,7.1,Twentieth Century Fox Film Corporation,United States of America,English
68000000,Drama,['religion and supernatural'],en,"Four boyhood pals perform a heroic act and are changed by the powers they gain in return. Years later, on a hunting trip in the Maine woods, they're overtaken by a vicious blizzard that harbors an ominous presence. Challenged to stop an alien force, the friends must first prevent the slaughter of innocent civilians by a military vigilante ... and then overcome a threat to the bond that unites the four of them.",26.792794,2003-03-21,75715436,136.0,A circle of friendship. A web of mystery. A pattern of fear.,Dreamcatcher,5.3,Village Roadshow Pictures,United States of America,English
63000000,Action,"['saving the world', 'artificial intelligence', 'man vs machine', 'philosophy', 'prophecy', 'martial arts', 'self sacrifice', 'fight', 'insurgence', 'virtual reality', 'dystopia', 'truth', 'cyberpunk', 'woman director', 'messiah', 'gnosticism']",en,"Set in the 22nd century, The Matrix tells the story of a computer hacker who joins a group of underground insurgents fighting the vast and powerful computers who now rule the earth.",104.309993,1999-03-30,463517383,136.0,Welcome to the Real World.,The Matrix,7.9,Village Roadshow Pictures,Australia,English
61000000,Drama,"['france', 'robbery', 'brothel', 'mayor', 'star', 'musical', 'arrest', 'army', 'rebellion', 'wedding', 'falling in love', 'corpse', 'parole', 'convict', 'girl disguised as boy']",en,"An adaptation of the successful stage musical based on Victor Hugo's classic novel set in 19th-century France, in which a paroled prisoner named Jean Valjean seeks redemption.",48.356214,2012-12-18,441809770,157.0,Fight. Dream. Hope. Love.,Les Misérables,7.1,Universal Pictures,United Kingdom,English
65000000,Comedy,"['romantic comedy', 'online dating', 'woman director']",en,"Book superstore magnate, Joe Fox and independent book shop owner, Kathleen Kelly fall in love in the anonymity of the Internet – both blissfully unaware that he's putting her out of business.",28.540267,1998-12-17,250821495,119.0,Someone you pass on the street may already be the love of your life.,You've Got Mail,6.3,Warner Bros.,United States of America,English
65000000,Comedy,"['highway', 'slacker', 'hitchhiker', 'wallet', 'sunglasses', 'rest stop', 'vicodin', 'waffle']",en,"Peter Highman must scramble across the US in five days to be present for the birth of his first child. He gets off to a bad start when his wallet and luggage are stolen, and put on the 'no-fly' list. Peter embarks on a terrifying journey when he accepts a ride from an actor.",43.865294,2010-11-04,211780824,95.0,Leave Your Comfort Zone,Due Date,6.2,Legendary Pictures,United States of America,English
65000000,Drama,"['world war ii', 'prisoners of war', 'biography', 'sport', 'war', 'athlete', 'woman director', 'olympic athlete']",en,"A chronicle of the life of Louis Zamperini, an Olympic runner who was taken prisoner by Japanese forces during World War II.",43.055253,2014-12-25,163442937,137.0,Survival. Resilience. Redemption.,Unbroken,7.3,Legendary Pictures,United States of America,Italiano
65000000,Action,"['nasa', 'space travel', 'astronaut', 'elderly']",en,"Frank Corvin, ‘Hawk’ Hawkins, Jerry O'Neill and ‘Tank’ Sullivan were hotdog members of Project Daedalus, the Air Force's test program for space travel, but their hopes were dashed in 1958 with the formation of NASA and the use of trained chimps. They blackmail their way into orbit when Russia's mysterious ‘Ikon’ communications satellite's orbit begins to degrade and threatens to crash to Earth.",15.772081,2000-07-31,128884132,130.0,Space will never be the same.,Space Cowboys,6.3,Village Roadshow Pictures,United States of America,English
