budget,genres,keywords,original_language,overview,popularity,release_date,revenue,runtime,tagline,title,vote_average,companies,countries,languages
6000000,Drama,"['based on novel', 'carpet', 'isolation', 'kidnapping', 'imprisonment', 'grandparents', 'escape', 'hospital', 'dog', 'captive', 'mother son relationship', 'shed', 'skylight']",en,Jack is a young boy of 5 years old who has lived all his life in one room. He believes everything within it are the only real things in the world. But what will happen when his Ma suddenly tells him that there are other things outside of Room?,66.11334000000001,2015-10-16,35401758,117.0,Love knows no boundaries,Room,8.1,Téléfilm Canada,Canada,English
13000000,Drama,"['shyness', 'secret', 'narration', 'kiss', 'freshman', 'coming of age', 'teenage boy', 'high school student', 'first love', 'aunt nephew relationship', 'gay lead character', 'santa hat', 'lgbt teen', 'aunt nephew incest', 'based on young adult novel']",en,"A coming-of-age story based on the best-selling novel by Stephen Chbosky, which follows 15-year-old freshman Charlie, an endearing and naive outsider who is taken under the wings of two seniors. A moving tale of love, loss, fear and hope - and the unforgettable friends that help us through life.",43.444135,2012-09-20,33400000,102.0,We are infinite.,The Perks of Being a Wallflower,7.7,Summit Entertainment,United States of America,English
14350531,Action,"['street gang', 'fireworks', 'chase', 'meteor', 'playground', 'arrest', 'cannabis', 'moped', 'car set on fire', 'car crash', 'alien', 'social satire', 'crime', 'race', 'naive children']",en,A teen gang in a grim South London housing estate must team up with the other residents to protect their neighbourhood from a terrifying alien invasion.,30.952377,2011-05-12,3964682,88.0,Inner City vs. Outer Space,Attack the Block,6.3,UK Film Council,United Kingdom,English
10000000,Drama,"['muslim', 'sister sister relationship', 'sarajevo', 'bosnian war of 1992-1995', 'violence', 'united nations', 'woman director']",en,"During the Bosnian War, Danijel, a soldier fighting for the Serbs, re-encounters Ajla, a Bosnian who's now a captive in his camp he oversees. Their once promising connection has become ambiguous as their motives have changed.",4.2674660000000015,2011-12-23,303877,127.0,Love can change what we want… war can change who we are,In the Land of Blood and Honey,5.8,FilmDistrict,United States of America,Bosanski
13000000,Crime,"['underground', 'gas station', 'kidnapping', 'murder', 'suspense', 'serial killer', 'american flag', 'multiple stabbings', 'violence', 'person on fire', 'cell phone', 'psycho']",en,"Jordan Turner is an experienced 911 operator but when she makes an error in judgment and a call ends badly, Jordan is rattled and unsure if she can continue. But when teenager Casey Welson is abducted in the back of a man's car and calls 911, Jordan is the one called upon to use all of her experience, insights and quick thinking to help Casey escape, and not just to save her, but to make sure the man is brought to justice.",34.532418,2013-03-14,68572378,94.0,There are 188 million 911 calls a year. This one made it personal.,The Call,6.6,TriStar Pictures,United States of America,English
13000000,Crime,"['sheriff', 'crime fighter']",en,"Deputy Sheriff Lou Ford is a pillar of the community in his small west Texas town, patient and apparently thoughtful. Some people think he is a little slow and maybe boring, but that is the worst they say about him. But then nobody knows about what Lou calls his ""sickness"": he is a brilliant, but disturbed sociopathic sadist.",11.892615,2010-02-19,0,109.0,Nobody See's It Coming,The Killer Inside Me,6.0,Revolution Films,United States of America,English
12000000,Comedy,"['garage', 'lone wolf', 'dying and death', 'loss', 'delusion', 'puppet', 'doll']",en,"Sometimes you find love where you'd least expect it. Just ask Lars, a sweet but quirky guy who thinks he's found the girl of his dreams in a life-sized doll named Bianca. Lars is completely content with his artificial girlfriend, but when he develops feelings for Margo, an attractive co-worker, Lars finds himself lost in a unique love triangle, hoping to somehow discover the real meaning of true love.",15.817096,2007-10-12,11293663,106.0,The search for true love begins outside the box.,Lars and the Real Girl,7.1,Sidney Kimmel Entertainment,United States of America,English
15000000,Comedy,"['infidelity', 'bankrupt', 'loneliness', 'comedy', 'family drama']",en,A car magnate watches his personal and professional life hit the skids because of his business and romantic indiscretions.,7.497306,2009-09-07,5024782,90.0,Ben loves his family almost as much as he loves himself,Solitary Man,5.8,Smartest Man Productions,United States of America,English
20000000,Action,"['illegal immigration', 'immigration law', 'machete', 'politician', 'death of a child', 'hard to kill', 'brutal death']",en,"After being set-up and betrayed by the man who hired him to assassinate a Texas Senator, an ex-Federale launches a brutal rampage of revenge against his former boss.",26.396191,2010-09-01,31327899,105.0,He was given an offer he couldn't refuse...,Machete,6.3,Dune Entertainment,United States of America,English
12500000,Crime,"['biography', 'duringcreditsstinger']",en,"Based on a true story, a hot shot Washington DC lobbyist and his protégé go down hard as their schemes to peddle influence lead to corruption and murder.",6.546037,2010-09-16,1083683,108.0,Honor. Integrity. Principles. Everything is negotiable.,Casino Jack,6.0,An Olive Branch Productions,Canada,English
12500000,Drama,"['baseball', 'sport', 'based on true story', 'family relationships']",en,"Based on a true story, a group of boys from Monterrey, Mexico who become the first non-U.S. team to win the Little League World Series.",0.903529,2010-04-01,3878993,118.0,Dream for the fences.,The Perfect Game,6.3,HighRoad Entertainment,United States of America,English
8000000,Drama,"['exorcism', 'holy water', 'religion and supernatural', 'vomit', 'christian', 'possession', 'profanity', 'priest', 'ouija board', 'satan', 'paranormal phenomena', 'girl', 'demon', 'strong language', 'disturbed child', 'crisis of faith', 'sfx']",en,"12-year-old Regan MacNeil begins to adapt an explicit new personality as strange events befall the local area of Georgetown. Her mother becomes torn between science and superstition in a desperate bid to save her daughter, and ultimately turns to her last hope: Father Damien Karras, a troubled priest who is struggling with his own faith.",47.584643,1973-12-26,441306145,122.0,"Something almost beyond comprehension is happening to a girl on this street, in this house... and a man has been sent for as a last resort. This man is The Exorcist.",The Exorcist,7.5,Warner Bros.,United States of America,Deutsch
7000000,Horror,"['fishing', 'atlantic ocean', 'bathing', 'shipwreck', 'police chief', 'ferry boat', 'dying and death', 'dolly zoom', 'shark', 'great white shark', 'animal horror']",en,"An insatiable great white shark terrorizes the townspeople of Amity Island, The police chief, an oceanographer and a grizzled shark hunter seek to destroy the bloodthirsty beast.",50.152327,1975-06-18,470654000,124.0,Don't go in the water.,Jaws,7.5,Universal Pictures,United States of America,English
12000000,Comedy,"['advice', 'love', 'relationship', 'ensemble cast', 'duringcreditsstinger', 'turning the tables', 'reading a book', 'african american comedy']",en,"The balance of power in four couples’ relationships is upset when the women start using the advice in Steve Harvey’s book, Act Like A Lady, Think Like A Man, to get more of what they want from their men. When the men realize that the women have gotten a hold of their relationship “playbook,” they decide that the best defense is a good offense and come up with a plan to use this information to their advantage.",6.035152,2012-04-16,96070507,122.0,Let the mind games begin.,Think Like a Man,6.9,Rainforest Films,United States of America,English
12000000,Thriller,"['video game', 'artificial intelligence', 'fbi', 'cold war', 'hacker', 'prosecution', 'norad', 'government', 'computer', 'nuclear threat']",en,"High School student David Lightman (Matthew Broderick) has a talent for hacking. But while trying to hack into a computer system to play unreleased video games, he unwittingly taps into the Defense Department's war computer and initiates a confrontation of global proportions! Together with his girlfriend (Ally Sheedy) and a wizardly computer genius (John Wood), David must race against time to outwit his opponent...and prevent a nuclear Armageddon.",23.161754,1983-06-03,79567667,114.0,"Is it a game, or is it real?",WarGames,7.0,United Artists,United States of America,English
12000000,Action,"['submarine', 'navy', 'scuba diving', 'heroism', 'navy seal', 'pistol', 'secret plot', 'military life', 'valor', 'terrorist plot', 'navy life', 'national security', 'pregnant wife', 'silver star', 'counter plot', 'duringcreditsstinger']",en,"When a covert mission to rescue a kidnapped CIA operative uncovers a chilling plot, an elite, highly trained U.S. SEAL team speeds to hotspots around the globe, racing against the clock to stop a deadly terrorist attack.",21.958055,2012-02-24,81272766,110.0,The only easy day was yesterday,Act of Valor,6.3,Relativity Media,United States of America,English
12000000,Comedy,"['terrorist', 'aftercreditsstinger', 'duringcreditsstinger']",en,"Having satisfied their urge for White Castle, Harold and Kumar jump on a plane to catch up with Harold's love interest, who's headed for the Netherlands. But the pair must change their plans when Kumar is accused of being a terrorist. Rob Corddry also stars in this wild comedy sequel that follows the hapless stoners' misadventures as they try to avoid being captured by the Department of Homeland Security.",26.219598,2008-04-25,43493123,107.0,This time they're running from the joint.,Harold & Kumar Escape from Guantanamo Bay,6.2,New Line Cinema,United States of America,English
12000000,Drama,"['sister sister relationship', 'blindness and impaired vision', 'eye operation', 'eyesight', 'dying and death', 'eye', 'classical music', 'sister', 'eye specialist', 'remake']",en,"Violinist Sydney Wells was accidentally blinded by her sister Helen when she was five years old. She submits to a cornea transplantation, and while recovering from the operation, she realizes that she is seeing dead people.",11.135734,2008-02-01,56309766,98.0,How can you believe your eyes when they're not yours?,The Eye,5.5,Paramount Vantage,United States of America,Español
12000000,Comedy,"['carpet', 'pimp', 'harvard university', 'joint', 'cannabis', 'teen movie', 'university', 'person on fire', 'cult film', 'dove', 'dean', 'weed+', 'marijuana joint', 'smoke', 'drug deal', 'canon', 'pot head', 'smoke ring', 'pill bottle', 'doves', 'baby powder', 'grave robbing', 'corpse in coffin', 'pillbox', 'pot']",en,"Multi-platinum rap superstars Redman and Method Man star as Jamal and Silas, two regular guys who smoke something magical, ace their college entrance exams and wind up at Harvard. Ivy League ways are strange but Silas and Jamal take it in a stride -- until their supply of supernatural smoke runs dry. That's when they have to start living by their wits and rely on their natural resources to make the grade.",11.510281,2001-12-21,31155435,93.0,They've got their degrees all rolled up.,How High,6.3,Universal Pictures,United States of America,English
12000000,Documentary,['woman director'],en,"Giving fans unprecedented access to the real life of the music sensation, Katy Perry: Part of Me exposes the hard work, dedication and phenomenal talent of a girl who remained true to herself and her vision in order to achieve her dreams. Featuring rare behind-the-scenes interviews, personal moments between Katy and her friends, and all-access footage of rehearsals, choreography, Katy’s signature style and more, Katy Perry: Part of Me reveals the singer’s unwavering belief that if you can be yourself, then you can be anything.",8.410688,2012-06-28,32726956,93.0,Be yourself and you can be anything,Katy Perry: Part of Me,6.5,Paramount Pictures,United States of America,English
0,Comedy,"['sex', 'lie', 'college', 'funeral', 'friendship', 'grief', 'neighbor', 'marijuana', 'anger', 'alcoholic', 'drunk', 'flashback', 'dysfunctional']",en,"After her husband runs off with his secretary, Terry Wolfmeyer is left to fend for herself -- and her four daughters. As she hits rock bottom, Terry finds a friend and drinking buddy in next-door neighbor Denny, a former baseball player. As the two grow closer, and her daughters increasingly rely on Denny, Terry starts to have reservations about where their relationship is headed.",6.2464,2005-01-23,0,118.0,Sometimes what tears us apart helps us put it back together.,The Upside of Anger,6.4,New Line Cinema,United States of America,English
12000000,Fantasy,"['female friendship', 'mermaid', 'teenager', 'woman director']",en,"Two teenage girls discover that mermaids really do exist after a violent storm washes one ashore. The mermaid, a sassy creature named Aquamarine, is determined to prove to her father that real love exists, and enlists the girls' help in winning the heart of a handsome lifeguard.",16.931846,2006-03-03,23006849,104.0,A Fish-Out-Of-Water Comedy.,Aquamarine,5.8,Fox 2000 Pictures,Australia,English
12000000,Comedy,"['jealousy', 'dark comedy', 'writer', 'divorce', 'alcoholic', 'arrested development']",en,"A divorced writer from the Midwest returns to her hometown to reconnect with an old flame, who's now married with a family.",16.183746,2011-12-16,22939027,94.0,Everyone gets old. Not everyone grows up.,Young Adult,5.6,Paramount Pictures,United States of America,English
14000000,Action,"['terror', 'submarine', 'based on novel', 'atlantic ocean', 'gibraltar', 'world war ii', 'duty', 'war correspondent', 'torpedo', 'drinking', 'sailor', 'convoy', 'u boat', 'destroyer', 'depth charge', 'comrade', 'german submarine', 'naval battle', 'periscope', 'suicidal mission']",de,"A German submarine hunts allied ships during the Second World War, but it soon becomes the hunted. The crew tries to survive below the surface, while stretching both the boat and themselves to their limits.",26.967494,1981-09-16,85000000,149.0,When the hunters become the hunted,Das Boot,7.9,Radiant Film GmbH,Germany,Deutsch
12000000,Science Fiction,"['time travel', 'time machine', 'teenager', 'found footage']",en,"A group of teens discover secret plans of a time machine, and construct one. However, things start to get out of control.",32.940597,2015-01-30,32248241,106.0,Today is better the second time around,Project Almanac,6.4,Paramount Pictures,United States of America,English
11000000,Horror,"['river', 'mobile phone', 'bravery', 'archer', 'daughter', 'sewerage', 'pollution', 'formaldehyde', 'snack bar', 'family']",ko,"Gang-du is a dim-witted man working at his father's tiny snack bar near the Han River. One day, Gang-du's one and only daughter Hyun-seo comes back from school irritated. She is angry at her uncle, Nam-il, who visited her school as her guardian shamelessly drunk. Ignoring her father's excuses for Nam-il, Hyun-seo is soon engrossed in her aunt Nam-joo's archery tournament on TV. Meanwhile, outside of the snack bar, people are fascinated by an unidentified object hanging onto a bridge. In an instant, the object reveals itself as a terrifying creature turning the riverbank into a gruesome sea of blood¡¦ Amid the chaos, Hyun-seo is helplessly snatched up by the creature right before Gang-du's eyes. These unforeseen circumstances render the government powerless to act. But receiving a call of help from Hyun-seo, the once-ordinary citizen Gang-du and his family are thrust into a battle with the monster to rescue their beloved Hyun-seo.",27.65527,2006-07-27,88489643,119.0,Monsters are real.,The Host,6.7,Cineclick Asia,South Korea,한국어/조선말
12000000,Comedy,"['depression', 'suicide attempt', 'medicine', 'new love', 'drug addiction', 'private school', 'girlfriend', 'advice', 'cleverness', 'high school', 'toilet', 'school performance', 'drama', 'independent film', 'teenage crush', 'psychiatrist', 'school bus']",en,"Awkward teenager Charlie Bartlett (Anton Yelchin) has trouble fitting in at a new high school. Charlie needs some friends fast, and decides that the best way to find them is to appoint himself the resident psychiatrist. He becomes one of the most popular guys in school by doling out advice and, occasionally, medication, to the student body.",9.779444,2008-02-22,0,97.0,Popularity is a state of mind.,Charlie Bartlett,6.5,Metro-Goldwyn-Mayer (MGM),United States of America,English
12000000,Drama,['mystery'],en,"After India's father dies, her Uncle Charlie, who she never knew existed, comes to live with her and her unstable mother. She comes to suspect this mysterious, charming man has ulterior motives and becomes increasingly infatuated with him.",27.322212,2013-02-28,12077441,99.0,Innocence Ends.,Stoker,6.5,Fox Searchlight Pictures,United States of America,English
12000000,Fantasy,"['free love', 'hotel', 'lovesickness', 'sexuality', 'kung fu', 'android', 'soulmates', 'based on novel', 'hotel room', 'jealousy', ""love of one's life"", 'restart', 'singapur', 'unsociability', 'secret love', 'murder', 'author', 'hong kong', 'break-up', 'illegal prostitution', 'extramarital affair', 'photographic memory']",zh,"2046 is the sequel to Wong Kar-Wais’ successful box-office hit In The Mood For Love. A film about affairs, ending relationships, and a shared love for Kung-Fu novels as the main character, Chow, writes his own novel and reflects back on his favorite love Su.",12.664787,2004-05-20,19271312,129.0,Are you still in the mood for love?,2046,6.9,Paradis Films,Germany,广州话 / 廣州話
12000000,Adventure,"['adolescence', 'loss of father', 'lion', 'south africa', 'bullying', 'kids and family', 'rescue', 'bully', 'young boy', 'cheetah', 'wild animal']",en,An orphaned cheetah becomes the best friend and pet of a young boy living in South Africa.,4.795244,2005-04-22,0,100.0,Some friendships are wilder than others,Duma,6.9,John Wells Productions,South Africa,English
12000000,Drama,"['alcohol', 'mermaid', 'wedding dress', 'fishing net', 'selkie']",en,An Irish fisherman discovers a woman in his fishing net believing her to be a mermaid.,5.841285,2009-09-14,1644755,111.0,The truth is not what you know. It's what you believe.,Ondine,6.5,Octagon Films,Ireland,English
12000000,Crime,"['brother brother relationship', 'assassination', 'culture clash', 'war on drugs', 'yakuza', 'sake', 'loyalty', 'drug dealer', 'femme fatale', 'los angeles']",ja,"A Japanese Yakuza gangster’s deadly existence in his homeland gets him exiled to Los Angeles, California, where he is taken in by his little brother and his brother’s gang. This is the first English film by Takeshi Kitano.",5.327714,2000-09-09,15250000,114.0,Are You Japanese?,Brother,6.8,Bandai Visual Company,United Kingdom,English
12000000,Drama,"['usa', 'sex', 'brother sister relationship', 'mexico city', 'border', 'support', 'insurance salesman', 'punter', 'brother', 'united states–mexico barrier', 'sister', 'human trafficking', 'rescue', 'independent film', 'criminal']",en,"A Texas cop (Kevin Kline), whose own daughter might have been forced into sexual slavery, joins forces with a Mexican youth (Cesar Ramos) to find the boy's sister, who was abducted and forced into prostitution. Meanwhile, a Ukrainian woman who was promised a better life in America also becomes a victim.",11.237374,2007-01-23,0,120.0,"Each year, more than 1,000,000 people are trafficked across international borders... against their will.",Trade,6.8,Centropolis Film Productions,Germany,Pусский
7500000,Thriller,"['double life', 'undercover', 'lie', 'wife', 'company', 'industry', 'femme fatale', 'conspiracy', 'espionage', 'memory loss', 'corporate crime', 'dystopic future', 'hidden identity', 'disorder', 'dishonesty', 'power relations', 'mind and soul', 'uncover truth', 'mysterious character']",en,"An unsuspecting, disenchanted man finds himself working as a spy in the dangerous, high-stakes world of corporate espionage. Quickly getting way over-his-head, he teams up with a mysterious femme fatale.",11.636883,2002-10-01,0,95.0,Never forget who you are,Cypher,6.7,Miramax Films,United States of America,English
12000000,Drama,"['based on novel', 'faith', 'based on true events']",en,"Heaven is for Real recounts the true story of a small-town father who must find the courage and conviction to share his son's extraordinary, life-changing experience with the world. Four-year-old Colton shares the details of his amazing journey with childlike innocence and speaks matter-of-factly about things that happened before his birth... things he couldn't possibly know.",11.150261,2014-04-16,101332962,99.0,Unlock the mystery,Heaven is for Real,6.0,TriStar Pictures,United States of America,English
11500000,Drama,['suspense'],en,"A young woman becomes inexplicably attracted to a man who is stalking her. When her boyfriend goes missing, the stalker is the immediate suspect, until a game of jealousy and betrayal turns deadly.",4.75919,2009-02-07,0,101.0,What would you do if someone was watching you?,The Cry of the Owl,5.5,MACT Productions,Canada,English
11000000,Adventure,"['android', 'galaxy', 'hermit', 'death star', 'lightsaber', 'jedi', 'rescue mission', 'empire', 'rebellion', 'planet', 'smuggler', 'the force', 'space opera', 'galactic war', 'stormtrooper', 'totalitarianism']",en,Princess Leia is captured and held hostage by the evil Imperial forces in their effort to take over the galactic Empire. Venturesome Luke Skywalker and dashing captain Han Solo team together with the loveable robot duo R2-D2 and C-3PO to rescue the beautiful princess and restore peace and justice in the Empire.,126.393695,1977-05-25,775398007,121.0,"A long time ago in a galaxy far, far away...",Star Wars,8.1,Lucasfilm,United States of America,English
11500000,Comedy,"['grandfather grandson relationship', 'grandfather', 'road trip', 'wedding', 'retired', 'pervert', 'army general', 'sex comedy']",en,"Jason Kelly is one week away from marrying his boss's uber-controlling daughter, putting him on the fast track for a partnership at the law firm. However, when the straight-laced Jason is tricked into driving his foul-mouthed grandfather, Dick, to Daytona for spring break, his pending nuptials are suddenly in jeopardy. Between riotous frat parties, bar fights, and an epic night of karaoke, Dick is on a quest to live his life to the fullest and bring Jason along for the ride.",56.805781,2016-01-21,94073028,102.0,This is Jason. He's a little worried about his grandpa.,Dirty Grandpa,5.7,Lionsgate,United States of America,English
25000000,Drama,"['sport', 'irish american', 'documentary crew', 'lowell massachusetts', 'blue collar worker', 'church bells', 'documentary filmmaking', 'boxer shorts', 'jumping rope', 'shadow boxing', 'duringcreditsstinger']",en,"The Fighter, is a drama about boxer ""Irish"" Micky Ward's unlikely road to the world light welterweight title. His Rocky-like rise was shepherded by half-brother Dicky, a boxer-turned-trainer who rebounded in life after nearly being KO'd by drugs and crime.",31.019381,2010-12-17,93617009,116.0,Every dream deserves a fighting chance.,The Fighter,7.2,Paramount Pictures,United States of America,English
0,Comedy,"['solidarity', 'snake', 'exhibit', 'musical', 'shenanigan', 'chaos', 'receiving of stolen goods', ""girls' boarding school"", 'quiz show', 'unorthodox', 'debt', 'principal', 'anarchy', 'group of friends', 'duringcreditsstinger', 'distillery']",en,"When their beloved school is threatened with closure should the powers that be fail to raise the proper funds, the girls scheme to steal a priceless painting and use the profits to pull St. Trinian's out of the red.",7.377586999999999,2007-12-21,0,101.0,Taking higher education to a new low.,St. Trinian's,5.6,Ealing Studios,United Kingdom,English
11000000,Drama,"['based on novel', 'theatre group', 'north carolina', 'theatre milieu', 'high school', 'cancer', 'coming of age', 'tragic love', 'teenager', 'star crossed lovers']",en,"When the popular, restless Landon Carter is forced to participate in the school drama production he falls in love with Jamie Sullivan, the daughter of the town's minister. Jamie has a ""to-do"" list for her life and also a very big secret she must keep from Landon.",33.283553999999995,2002-01-25,41227069,101.0,She didn't belong. She was misunderstood. And she would change him forever.,A Walk to Remember,7.5,DiNovi Pictures,United States of America,English
11000000,Horror,['aftercreditsstinger'],en,"Special Agent Strahm is dead, and Detective Hoffman has emerged as the unchallenged successor to Jigsaw's legacy. However, when the FBI draws closer to Hoffman, he is forced to set a game into motion, and Jigsaw's grand scheme is finally understood.",31.900899,2009-10-22,68233629,90.0,The Game Has Come Full Circle,Saw VI,6.0,Lionsgate,Australia,English
11000000,Adventure,['woman director'],en,"Set in South Carolina in 1964, this is the tale of Lily Owens a 14 year-old girl who is haunted by the memory of her late mother. To escape her lonely life and troubled relationship with her father, Lily flees with Rosaleen, her caregiver and only friend, to a South Carolina town that holds the secret to her mother's past.",7.645979,2008-09-17,38105395,114.0,"Bring Your Girlfriends, Sisters, Mothers and Daughters.",The Secret Life of Bees,7.4,Fox Searchlight Pictures,United States of America,English
